,RC_ID,RC_Name,Classification,tr_retailN,Region,Country,AverageIMD,IMDRegional,diff_IMDRegional,r_IMDRegional,IMDNational,diff_IMDNational,r_IMDNational,whichCentroid
361,RC_EW_2342,High Street; Royston; North Hertfordshire (East of England; England),Local Centre,139,East of England,England,4.7515,17.34827615,-12.59677615,LESS DEPRIVED,21.66939261,-16.91789261,LESS DEPRIVED,Population-Weighted
362,RC_EW_2347,Corbets Tey Road; Upminster; Havering (London; England),District Centre,190,London,England,5.3492,21.49842441,-16.14922441,LESS DEPRIVED,21.66939261,-16.32019261,LESS DEPRIVED,Population-Weighted
363,RC_EW_2355,High Street; Hornchurch; Havering (London; England),District Centre,181,London,England,11.78225,21.49842441,-9.716174405,LESS DEPRIVED,21.66939261,-9.887142614,LESS DEPRIVED,Population-Weighted
364,RC_EW_236,Hall Road Retail Park; Norwich (East of England; England),Small Retail Park,15,East of England,England,36.15766667,17.34827615,18.80939052,MORE DEPRIVED,21.66939261,14.48827405,MORE DEPRIVED,Population-Weighted
365,RC_EW_2361,Elm Park; Havering (London; England),Local Centre,114,London,England,14.103625,21.49842441,-7.394799405,LESS DEPRIVED,21.66939261,-7.565767614,LESS DEPRIVED,Population-Weighted
366,RC_EW_2368,Romford; London (London; England),Major Town Centre,570,London,England,20.442,21.49842441,-1.056424405,LESS DEPRIVED,21.66939261,-1.227392614,LESS DEPRIVED,Population-Weighted
367,RC_EW_2372,Brentwood; Brentwood (East of England; England),Town Centre,303,East of England,England,12.23942857,17.34827615,-5.108847577,LESS DEPRIVED,21.66939261,-9.429964042,LESS DEPRIVED,Population-Weighted
368,RC_EW_2380,Orsett Road; Grays; Thurrock (East of England; England),District Centre,196,East of England,England,24.79875,17.34827615,7.450473852,MORE DEPRIVED,21.66939261,3.129357386,MORE DEPRIVED,Population-Weighted
369,RC_EW_2382,Lakeside Shopping Centre; Thurrock (East of England; England),Large Shopping Centre,324,East of England,England,6.891,17.34827615,-10.45727615,LESS DEPRIVED,21.66939261,-14.77839261,LESS DEPRIVED,Population-Weighted
370,RC_EW_2387,Gravesend; Gravesham (South East; England),Town Centre,463,South East,England,26.6565,15.47743181,11.17906819,MORE DEPRIVED,21.66939261,4.987107386,MORE DEPRIVED,Population-Weighted
371,RC_EW_239,Fakenham; North Norfolk (East of England; England),Local Centre,123,East of England,England,23.954,17.34827615,6.605723852,MORE DEPRIVED,21.66939261,2.284607386,MORE DEPRIVED,Population-Weighted
372,RC_EW_2397,George Lane; South Woodford; Redbridge (London; England),District Centre,198,London,England,10.592,21.49842441,-10.90642441,LESS DEPRIVED,21.66939261,-11.07739261,LESS DEPRIVED,Population-Weighted
373,RC_EW_24,Fore Street; Looe; Cornwall (South West; England),District Centre,162,South West,England,16.907,18.2526559,-1.345655898,LESS DEPRIVED,21.66939261,-4.762392614,LESS DEPRIVED,Population-Weighted
374,RC_EW_2400,Cranbrook Road; Gants Hill; Redbridge (London; England),Local Centre,130,London,England,13.25809091,21.49842441,-8.240333496,LESS DEPRIVED,21.66939261,-8.411301704,LESS DEPRIVED,Population-Weighted
375,RC_EW_2404,Wood Street; Upper Walthamstow; Waltham Forest (London; England),District Centre,177,London,England,30.3256,21.49842441,8.827175595,MORE DEPRIVED,21.66939261,8.656207386,MORE DEPRIVED,Population-Weighted
376,RC_EW_2406,Walthamstow; Waltham Forest (London; England),Town Centre,729,London,England,26.762,21.49842441,5.263575595,MORE DEPRIVED,21.66939261,5.092607386,MORE DEPRIVED,Population-Weighted
377,RC_EW_2408,High Road Leytonstone; Leytonstone; Waltham Forest (London; England),District Centre,164,London,England,22.3295,21.49842441,0.831075595,MORE DEPRIVED,21.66939261,0.660107386,MORE DEPRIVED,Population-Weighted
378,RC_EW_2409,High Street Wanstead; Wanstead; Redbridge (London; England),Local Centre,114,London,England,9.944833333,21.49842441,-11.55359107,LESS DEPRIVED,21.66939261,-11.72455928,LESS DEPRIVED,Population-Weighted
379,RC_EW_241,Westgate; Hunstanton; King's Lynn and West Norfolk (East of England; England),Local Centre,120,East of England,England,29.56766667,17.34827615,12.21939052,MORE DEPRIVED,21.66939261,7.898274053,MORE DEPRIVED,Population-Weighted
380,RC_EW_2417,High Street Barkingside; Fullwell Cross; Redbridge (London; England),Local Centre,139,London,England,16.32075,21.49842441,-5.177674405,LESS DEPRIVED,21.66939261,-5.348642614,LESS DEPRIVED,Population-Weighted
381,RC_EW_2419,Winchester Road; Highams Park; Waltham Forest (London; England),Local Centre,118,London,England,18.75411111,21.49842441,-2.744313294,LESS DEPRIVED,21.66939261,-2.915281502,LESS DEPRIVED,Population-Weighted
382,RC_EW_2422,High Street North; Wallend; Newham (London; England),District Centre,503,London,England,27.02905882,21.49842441,5.530634418,MORE DEPRIVED,21.66939261,5.35966621,MORE DEPRIVED,Population-Weighted
383,RC_EW_2423,Barking; Barking and Dagenham (London; England),Town Centre,316,London,England,31.8572,21.49842441,10.35877559,MORE DEPRIVED,21.66939261,10.18780739,MORE DEPRIVED,Population-Weighted
384,RC_EW_2424,Gallions Reach Shopping Park; Newham (London; England),Small Retail Park,21,London,England,27.209,21.49842441,5.710575595,MORE DEPRIVED,21.66939261,5.539607386,MORE DEPRIVED,Geometric
385,RC_EW_2425,Gateway Retail Park; Newham (London; England),Small Retail Park,18,London,England,29.531,21.49842441,8.032575595,MORE DEPRIVED,21.66939261,7.861607386,MORE DEPRIVED,Geometric
386,RC_EW_2426,Upton; Newham (London; England),Town Centre,568,London,England,29.51148649,21.49842441,8.013062081,MORE DEPRIVED,21.66939261,7.842093873,MORE DEPRIVED,Population-Weighted
387,RC_EW_2434,Upton Lane; Forest Gate; Newham (London; England),Local Centre,149,London,England,30.94066667,21.49842441,9.442242261,MORE DEPRIVED,21.66939261,9.271274053,MORE DEPRIVED,Population-Weighted
388,RC_EW_2435,Beckton Retail Park; Newham (London; England),Small Retail Park,22,London,England,32.3988,21.49842441,10.90037559,MORE DEPRIVED,21.66939261,10.72940739,MORE DEPRIVED,Population-Weighted
389,RC_EW_2437,Ilford; London (London; England),Major Town Centre,555,London,England,26.4301,21.49842441,4.931675595,MORE DEPRIVED,21.66939261,4.760707386,MORE DEPRIVED,Population-Weighted
390,RC_EW_2439,Romford Road; Manor Park; Newham (London; England),District Centre,271,London,England,30.35466667,21.49842441,8.856242261,MORE DEPRIVED,21.66939261,8.685274053,MORE DEPRIVED,Population-Weighted
391,RC_EW_2442,The Exchange Mall; Redbridge (London; England),Large Retail Park,51,London,England,24.40925,21.49842441,2.910825595,MORE DEPRIVED,21.66939261,2.739857386,MORE DEPRIVED,Population-Weighted
392,RC_EW_2445,The Exchange Mall; Redbridge (London; England) - 1,Small Retail Park,19,London,England,22.52325,21.49842441,1.024825595,MORE DEPRIVED,21.66939261,0.853857386,MORE DEPRIVED,Population-Weighted
393,RC_EW_2451,Fore Street; Upper Edmonton; Enfield (London; England),District Centre,162,London,England,40.0483,21.49842441,18.54987559,MORE DEPRIVED,21.66939261,18.37890739,MORE DEPRIVED,Population-Weighted
394,RC_EW_246,Forest Retail Park; Breckland (East of England; England),Small Retail Park,16,NA,NA,NA,NA,NA,NA,NA,NA,NA,NA
395,RC_EW_2464,Tottenham Hale Retail Park; Haringey (London; England),Large Retail Park,32,London,England,40.53583333,21.49842441,19.03740893,MORE DEPRIVED,21.66939261,18.86644072,MORE DEPRIVED,Population-Weighted
396,RC_EW_2465,High Road; Tottenham; Haringey (London; England),District Centre,208,London,England,37.34227273,21.49842441,15.84384832,MORE DEPRIVED,21.66939261,15.67288011,MORE DEPRIVED,Population-Weighted
397,RC_EW_2467,West Green Road; Tottenham; Haringey (London; England),District Centre,165,London,England,38.2524,21.49842441,16.75397559,MORE DEPRIVED,21.66939261,16.58300739,MORE DEPRIVED,Population-Weighted
398,RC_EW_2471,Stamford Hill; South Tottenham; Hackney (London; England),Local Centre,115,London,England,30.672625,21.49842441,9.174200595,MORE DEPRIVED,21.66939261,9.003232386,MORE DEPRIVED,Population-Weighted
399,RC_EW_2472,Cork Tree Retail Park; Waltham Forest (London; England),Small Retail Park,23,London,England,34.2495,21.49842441,12.75107559,MORE DEPRIVED,21.66939261,12.58010739,MORE DEPRIVED,Population-Weighted
400,RC_EW_2474,Edmonton; Enfield (London; England),District Centre,161,London,England,38.8738,21.49842441,17.37537559,MORE DEPRIVED,21.66939261,17.20440739,MORE DEPRIVED,Population-Weighted
401,RC_EW_2478,Old Church Road; Highams Park; Waltham Forest (London; England),District Centre,156,London,England,20.94925,21.49842441,-0.549174405,LESS DEPRIVED,21.66939261,-0.720142614,LESS DEPRIVED,Population-Weighted
402,RC_EW_248,Thetford; Breckland (East of England; England),Local Centre,138,East of England,England,23.112,17.34827615,5.763723852,MORE DEPRIVED,21.66939261,1.442607386,MORE DEPRIVED,Population-Weighted
403,RC_EW_2481,Westfield Stratford City; Newham (London; England),Large Shopping Centre,375,London,England,28.49625,21.49842441,6.997825595,MORE DEPRIVED,21.66939261,6.826857386,MORE DEPRIVED,Population-Weighted
404,RC_EW_2483,Leyton Mills Retail Park; Waltham Forest (London; England),Small Retail Park,2,London,England,24.3625,21.49842441,2.864075595,MORE DEPRIVED,21.66939261,2.693107386,MORE DEPRIVED,Population-Weighted
405,RC_EW_2484,High Road Leyton; Temple Mills; Waltham Forest (London; England),Local Centre,137,London,England,23.28563636,21.49842441,1.787211958,MORE DEPRIVED,21.66939261,1.61624375,MORE DEPRIVED,Population-Weighted
406,RC_EW_2486,The Stratford Centre; Stratford; Newham (London; England),District Centre,327,London,England,28.71233333,21.49842441,7.213908928,MORE DEPRIVED,21.66939261,7.04294072,MORE DEPRIVED,Population-Weighted
407,RC_EW_2489,Burberry Factory Outlet London; Hackney (London; England),Large Shopping Centre,224,London,England,34.53687879,21.49842441,13.03845438,MORE DEPRIVED,21.66939261,12.86748617,MORE DEPRIVED,Population-Weighted
408,RC_EW_2490,Lower Clapton Road; Lower Clapton; Hackney (London; England),Local Centre,100,London,England,32.60671429,21.49842441,11.10828988,MORE DEPRIVED,21.66939261,10.93732167,MORE DEPRIVED,Population-Weighted
409,RC_EW_2498,Roman Road; Bow; Tower Hamlets (London; England),District Centre,188,London,England,27.4114,21.49842441,5.912975595,MORE DEPRIVED,21.66939261,5.742007386,MORE DEPRIVED,Population-Weighted
410,RC_EW_2502,Hoe Street; Leyton; Waltham Forest (London; England),District Centre,219,London,England,27.02157143,21.49842441,5.523147023,MORE DEPRIVED,21.66939261,5.352178815,MORE DEPRIVED,Population-Weighted
411,RC_EW_2504,Lea Bridge Road; Leyton; Waltham Forest (London; England),Local Centre,126,London,England,32.02018182,21.49842441,10.52175741,MORE DEPRIVED,21.66939261,10.3507892,MORE DEPRIVED,Population-Weighted
412,RC_EW_2508,High Road Leytonstone; Stratford New Town; Newham (London; England),Local Centre,134,London,England,27.46569231,21.49842441,5.967267902,MORE DEPRIVED,21.66939261,5.796299694,MORE DEPRIVED,Population-Weighted
413,RC_EW_251,Dereham; Breckland (East of England; England),Town Centre,213,East of England,England,24.765,17.34827615,7.416723852,MORE DEPRIVED,21.66939261,3.095607386,MORE DEPRIVED,Population-Weighted
414,RC_EW_2520,Loughton; Epping Forest (East of England; England),Town Centre,163,East of England,England,7.525875,17.34827615,-9.822401148,LESS DEPRIVED,21.66939261,-14.14351761,LESS DEPRIVED,Population-Weighted
415,RC_EW_2523,High Road; Chadwell Heath; Barking and Dagenham (London; England),District Centre,182,London,England,23.2122,21.49842441,1.713775595,MORE DEPRIVED,21.66939261,1.542807386,MORE DEPRIVED,Population-Weighted
416,RC_EW_2524,Goodmayes Road; Goodmayes; Redbridge (London; England),District Centre,160,London,England,20.42275,21.49842441,-1.075674405,LESS DEPRIVED,21.66939261,-1.246642614,LESS DEPRIVED,Population-Weighted
417,RC_EW_2526,Green Lane; Goodmayes; Redbridge (London; England),Local Centre,109,London,England,32.086875,21.49842441,10.58845059,MORE DEPRIVED,21.66939261,10.41748239,MORE DEPRIVED,Population-Weighted
418,RC_EW_253,Market Street; Wymondham; South Norfolk (East of England; England),Local Centre,143,East of England,England,16.923,17.34827615,-0.425276148,LESS DEPRIVED,21.66939261,-4.746392614,LESS DEPRIVED,Population-Weighted
419,RC_EW_2544,Hainault Underground Shopping Area; Redbridge (London; England),Small Retail Park,16,East of England,England,26.987,17.34827615,9.638723852,MORE DEPRIVED,21.66939261,5.317607386,MORE DEPRIVED,Population-Weighted
420,RC_EW_2544,Hainault Underground Shopping Area; Redbridge (London; England),Small Retail Park,16,London,England,19.0272,21.49842441,-2.471224405,LESS DEPRIVED,21.66939261,-2.642192614,LESS DEPRIVED,Population-Weighted
421,RC_EW_2545,Station Road; Chingford; Waltham Forest (London; England),District Centre,152,London,England,12.24066667,21.49842441,-9.257757739,LESS DEPRIVED,21.66939261,-9.428725947,LESS DEPRIVED,Population-Weighted
422,RC_EW_2549,Crayford High Street; Crayford; Bexley (London; England),Local Centre,132,London,England,17.60575,21.49842441,-3.892674405,LESS DEPRIVED,21.66939261,-4.063642614,LESS DEPRIVED,Population-Weighted
423,RC_EW_255,Market Place; Swaffham; Breckland (East of England; England),Local Centre,143,East of England,England,35.0205,17.34827615,17.67222385,MORE DEPRIVED,21.66939261,13.35110739,MORE DEPRIVED,Population-Weighted
424,RC_EW_2550,Temple Hill; Dartford (South East; England),Town Centre,312,South East,England,20.63444444,15.47743181,5.157012635,MORE DEPRIVED,21.66939261,-1.034948169,LESS DEPRIVED,Population-Weighted
425,RC_EW_2552,Bexleyheath; Bexley (London; England),Town Centre,273,London,England,12.07115385,21.49842441,-9.427270559,LESS DEPRIVED,21.66939261,-9.598238767,LESS DEPRIVED,Population-Weighted
426,RC_EW_2557,Erith Riverside Shopping Centre; Bexley (London; England),Large Retail Park,68,London,England,36.05533333,21.49842441,14.55690893,MORE DEPRIVED,21.66939261,14.38594072,MORE DEPRIVED,Population-Weighted
427,RC_EW_2562,Plumstead High Street; Plumstead Common; Greenwich (London; England),Local Centre,123,London,England,27.6904,21.49842441,6.191975595,MORE DEPRIVED,21.66939261,6.021007386,MORE DEPRIVED,Population-Weighted
428,RC_EW_2567,Bellegrove Road; Welling; Bexley (London; England),District Centre,252,London,England,13.7565,21.49842441,-7.741924405,LESS DEPRIVED,21.66939261,-7.912892614,LESS DEPRIVED,Population-Weighted
429,RC_EW_2569,Woolwich; Greenwich (London; England),Town Centre,298,London,England,29.20305882,21.49842441,7.704634418,MORE DEPRIVED,21.66939261,7.53366621,MORE DEPRIVED,Population-Weighted
430,RC_EW_2571,Cannon Retail Park; Greenwich (London; England),Large Retail Park,28,London,England,24.922,21.49842441,3.423575595,MORE DEPRIVED,21.66939261,3.252607386,MORE DEPRIVED,Population-Weighted
431,RC_EW_2574,Sidcup High Street; Sidcup; Bexley (London; England),District Centre,154,London,England,15.62675,21.49842441,-5.871674405,LESS DEPRIVED,21.66939261,-6.042642614,LESS DEPRIVED,Population-Weighted
432,RC_EW_2589,Bluewater; Dartford (South East; England),Large Shopping Centre,302,South East,England,19.552,15.47743181,4.07456819,MORE DEPRIVED,21.66939261,-2.117392614,LESS DEPRIVED,Population-Weighted
433,RC_EW_2593,Merrielands Retail Park; Barking and Dagenham (London; England),Large Retail Park,63,London,England,37.2005,21.49842441,15.70207559,MORE DEPRIVED,21.66939261,15.53110739,MORE DEPRIVED,Population-Weighted
434,RC_EW_2594,Heathway; Dagenham; Barking and Dagenham (London; England),Local Centre,110,London,England,36.5832,21.49842441,15.08477559,MORE DEPRIVED,21.66939261,14.91380739,MORE DEPRIVED,Population-Weighted
435,RC_EW_2606,Mayflower Retail Park; Basildon (East of England; England),Small Retail Park,22,NA,NA,NA,NA,NA,NA,NA,NA,NA,NA
436,RC_EW_2607,Festival Leisure Park; Basildon (East of England; England),Small Retail Park,7,East of England,England,41.836,17.34827615,24.48772385,MORE DEPRIVED,21.66939261,20.16660739,MORE DEPRIVED,Geometric
437,RC_EW_2608,High Street; Wickford; Basildon (East of England; England),District Centre,156,East of England,England,15.29025,17.34827615,-2.058026148,LESS DEPRIVED,21.66939261,-6.379142614,LESS DEPRIVED,Population-Weighted
438,RC_EW_2609,Pitsea Retail Park; Basildon (East of England; England),Large Retail Park,41,East of England,England,31.1895,17.34827615,13.84122385,MORE DEPRIVED,21.66939261,9.520107386,MORE DEPRIVED,Population-Weighted
439,RC_EW_261,High Street; Gorleston-on-Sea; Great Yarmouth (East of England; England),Local Centre,105,East of England,England,31.85525,17.34827615,14.50697385,MORE DEPRIVED,21.66939261,10.18585739,MORE DEPRIVED,Population-Weighted
440,RC_EW_2613,High Street; Billericay; Basildon (East of England; England),Market Town,164,East of England,England,5.6695,17.34827615,-11.67877615,LESS DEPRIVED,21.66939261,-15.99989261,LESS DEPRIVED,Population-Weighted
441,RC_EW_2616,Pipps Hill Retail Park; Basildon (East of England; England),Small Retail Park,17,East of England,England,31.244,17.34827615,13.89572385,MORE DEPRIVED,21.66939261,9.574607386,MORE DEPRIVED,Population-Weighted
442,RC_EW_2617,Basildon; Basildon (East of England; England),Town Centre,294,East of England,England,24.303,17.34827615,6.954723852,MORE DEPRIVED,21.66939261,2.633607386,MORE DEPRIVED,Population-Weighted
443,RC_EW_2619,Stadium Way Retail Park; Castle Point (East of England; England),Small Retail Park,22,East of England,England,16.325,17.34827615,-1.023276148,LESS DEPRIVED,21.66939261,-5.344392614,LESS DEPRIVED,Population-Weighted
444,RC_EW_2623,High Street; Epping; Epping Forest (East of England; England) - 1,Local Centre,123,East of England,England,13.019,17.34827615,-4.329276148,LESS DEPRIVED,21.66939261,-8.650392614,LESS DEPRIVED,Population-Weighted
445,RC_EW_2624,Staple Tye Shopping Centre; Harlow (East of England; England),Small Retail Park,16,East of England,England,24.37814286,17.34827615,7.029866709,MORE DEPRIVED,21.66939261,2.708750244,MORE DEPRIVED,Population-Weighted
446,RC_EW_2628,Harlow; Harlow (East of England; England),Town Centre,242,East of England,England,25.17928571,17.34827615,7.831009566,MORE DEPRIVED,21.66939261,3.509893101,MORE DEPRIVED,Population-Weighted
447,RC_EW_2630,The Oaks Retail Park; Harlow (East of England; England),Small Retail Park,21,East of England,England,23.1205,17.34827615,5.772223852,MORE DEPRIVED,21.66939261,1.451107386,MORE DEPRIVED,Geometric
448,RC_EW_2633,Anglia Retail Park; Ipswich (East of England; England),Small Retail Park,19,East of England,England,44.451,17.34827615,27.10272385,MORE DEPRIVED,21.66939261,22.78160739,MORE DEPRIVED,Geometric
449,RC_EW_2635,Stowmarket; Mid Suffolk (East of England; England),Town Centre,138,East of England,England,18.16671429,17.34827615,0.818438137,MORE DEPRIVED,21.66939261,-3.502678328,LESS DEPRIVED,Population-Weighted
450,RC_EW_2636,Euro Retail Park; Ipswich (East of England; England),Large Retail Park,32,East of England,England,29.058,17.34827615,11.70972385,MORE DEPRIVED,21.66939261,7.388607386,MORE DEPRIVED,Population-Weighted
451,RC_EW_264,Great Yarmouth; Great Yarmouth (East of England; England),Town Centre,463,East of England,England,62.277375,17.34827615,44.92909885,MORE DEPRIVED,21.66939261,40.60798239,MORE DEPRIVED,Population-Weighted
452,RC_EW_2641,Interchange Retail Park; Babergh (East of England; England),Small Retail Park,3,East of England,England,9.537,17.34827615,-7.811276148,LESS DEPRIVED,21.66939261,-12.13239261,LESS DEPRIVED,Population-Weighted
453,RC_EW_2643,Martlesham Heath Retail Park; East Suffolk (East of England; England),Small Retail Park,13,East of England,England,8.167,17.34827615,-9.181276148,LESS DEPRIVED,21.66939261,-13.50239261,LESS DEPRIVED,Population-Weighted
454,RC_EW_2645,Ipswich; Ipswich (East of England; England),Major Town Centre,675,East of England,England,35.06827273,17.34827615,17.71999658,MORE DEPRIVED,21.66939261,13.39888011,MORE DEPRIVED,Population-Weighted
455,RC_EW_2652,Thoroughfare; Woodbridge; East Suffolk (East of England; England),District Centre,172,East of England,England,11.159,17.34827615,-6.189276148,LESS DEPRIVED,21.66939261,-10.51039261,LESS DEPRIVED,Population-Weighted
456,RC_EW_2654,Clacton-on-Sea; Tendring (East of England; England),Town Centre,333,East of England,England,49.1531,17.34827615,31.80482385,MORE DEPRIVED,21.66939261,27.48370739,MORE DEPRIVED,Population-Weighted
457,RC_EW_266,Gapton Hall Retail Park; Great Yarmouth (East of England; England),Small Retail Park,15,NA,NA,NA,NA,NA,NA,NA,NA,NA,NA
458,RC_EW_2660,Brook Retail Park; Tendring (East of England; England),Small Retail Park,0,NA,NA,NA,NA,NA,NA,NA,NA,NA,NA
459,RC_EW_2661,Clacton Factory Outlet; Tendring (East of England; England),Small Shopping Centre,17,East of England,England,23.99,17.34827615,6.641723852,MORE DEPRIVED,21.66939261,2.320607386,MORE DEPRIVED,Geometric
460,RC_EW_2663,Connaught Avenue; Frinton-on-Sea; Tendring (East of England; England),Local Centre,148,East of England,England,15.39933333,17.34827615,-1.948942815,LESS DEPRIVED,21.66939261,-6.27005928,LESS DEPRIVED,Population-Weighted
461,RC_EW_2669,Triangle Shopping Centre; Tendring (East of England; England),Small Retail Park,18,East of England,England,22.224,17.34827615,4.875723852,MORE DEPRIVED,21.66939261,0.554607386,MORE DEPRIVED,Population-Weighted
462,RC_EW_2673,High Street; Dovercourt; Tendring (East of England; England),Local Centre,129,East of England,England,41.92133333,17.34827615,24.57305719,MORE DEPRIVED,21.66939261,20.25194072,MORE DEPRIVED,Population-Weighted
463,RC_EW_2676,High Street; Newmarket; West Suffolk (East of England; England),Market Town,202,East of England,England,19.77175,17.34827615,2.423473852,MORE DEPRIVED,21.66939261,-1.897642614,LESS DEPRIVED,Population-Weighted
464,RC_EW_2681,Beehive Centre Retail Park; Cambridge (East of England; England),Small Retail Park,23,East of England,England,17.09233333,17.34827615,-0.255942815,LESS DEPRIVED,21.66939261,-4.57705928,LESS DEPRIVED,Population-Weighted
465,RC_EW_2685,Grafton Centre; Cambridge; Cambridge (East of England; England),District Centre,159,East of England,England,13.727,17.34827615,-3.621276148,LESS DEPRIVED,21.66939261,-7.942392614,LESS DEPRIVED,Population-Weighted
466,RC_EW_2686,Cambridge; Cambridge (East of England; England),Major Town Centre,410,East of England,England,13.1355,17.34827615,-4.212776148,LESS DEPRIVED,21.66939261,-8.533892614,LESS DEPRIVED,Population-Weighted
467,RC_EW_2693,Cambridge Leisure Park; Cambridge (East of England; England),Large Retail Park,49,East of England,England,9.166333333,17.34827615,-8.181942815,LESS DEPRIVED,21.66939261,-12.50305928,LESS DEPRIVED,Population-Weighted
468,RC_EW_2702,Bury St Edmunds; West Suffolk (East of England; England),Town Centre,426,East of England,England,18.4065,17.34827615,1.058223852,MORE DEPRIVED,21.66939261,-3.262892614,LESS DEPRIVED,Population-Weighted
469,RC_EW_2704,St. Edmundsbury Retail Park; West Suffolk (East of England; England),Small Retail Park,24,East of England,England,4.307,17.34827615,-13.04127615,LESS DEPRIVED,21.66939261,-17.36239261,LESS DEPRIVED,Population-Weighted
470,RC_EW_2705,Ely; East Cambridgeshire (East of England; England),Town Centre,207,East of England,England,12.13566667,17.34827615,-5.212609482,LESS DEPRIVED,21.66939261,-9.533725947,LESS DEPRIVED,Population-Weighted
471,RC_EW_2707,Whitehaven; Copeland (North West; England),Town Centre,281,North West,England,31.72325,27.90890505,3.814344952,MORE DEPRIVED,21.66939261,10.05385739,MORE DEPRIVED,Population-Weighted
472,RC_EW_2709,Workington; Allerdale (North West; England),Town Centre,246,North West,England,29.21614286,27.90890505,1.307237809,MORE DEPRIVED,21.66939261,7.546750244,MORE DEPRIVED,Population-Weighted
473,RC_EW_2713,Wallasey Road; Liscard; Wirral (North West; England),District Centre,238,North West,England,29.2328,27.90890505,1.323894952,MORE DEPRIVED,21.66939261,7.563407386,MORE DEPRIVED,Population-Weighted
474,RC_EW_2716,Marine Point; Wirral (North West; England),Small Retail Park,18,North West,England,36.06533333,27.90890505,8.156428286,MORE DEPRIVED,21.66939261,14.39594072,MORE DEPRIVED,Population-Weighted
475,RC_EW_2720,Chapel Lane; Formby; Sefton (North West; England),Local Centre,121,North West,England,10.464,27.90890505,-17.44490505,LESS DEPRIVED,21.66939261,-11.20539261,LESS DEPRIVED,Population-Weighted
476,RC_EW_2721,Liverpool Road; Great Crosby; Sefton (North West; England),Local Centre,117,North West,England,13.36014286,27.90890505,-14.54876219,LESS DEPRIVED,21.66939261,-8.309249756,LESS DEPRIVED,Population-Weighted
477,RC_EW_2723,St Johns Road; Crosby; Sefton (North West; England),Local Centre,120,North West,England,22.72233333,27.90890505,-5.186571714,LESS DEPRIVED,21.66939261,1.05294072,MORE DEPRIVED,Population-Weighted
478,RC_EW_2729,South Road; Crosby; Sefton (North West; England),Local Centre,106,North West,England,36.4268,27.90890505,8.517894952,MORE DEPRIVED,21.66939261,14.75740739,MORE DEPRIVED,Population-Weighted
479,RC_EW_2739,Smithdown Road; Wavertree; Liverpool (North West; England),Local Centre,139,North West,England,27.27088889,27.90890505,-0.638016159,LESS DEPRIVED,21.66939261,5.601496275,MORE DEPRIVED,Population-Weighted
480,RC_EW_2743,Edge Lane Retail Park; Liverpool (North West; England),Small Retail Park,22,North West,England,54.30966667,27.90890505,26.40076162,MORE DEPRIVED,21.66939261,32.64027405,MORE DEPRIVED,Population-Weighted
481,RC_EW_2746,Allerton Road; Wavertree; Liverpool (North West; England),District Centre,182,North West,England,20.358,27.90890505,-7.550905048,LESS DEPRIVED,21.66939261,-1.311392614,LESS DEPRIVED,Population-Weighted
482,RC_EW_2751,Liverpool City; Liverpool (North West; England),Regional Centre,1329,North West,England,20.904625,27.90890505,-7.004280048,LESS DEPRIVED,21.66939261,-0.764767614,LESS DEPRIVED,Population-Weighted
