,RC_ID,RC_Name,Classification,tr_retailN,Region,Country,AverageIMD,IMDRegional,diff_IMDRegional,r_IMDRegional,IMDNational,diff_IMDNational,r_IMDNational,whichCentroid
962,RC_EW_4629,High Street; Droitwich Spa; Wychavon (West Midlands; England),Market Town,152,West Midlands,England,24.989,24.95302782,0.035972182,MORE DEPRIVED,21.66939261,3.319607386,MORE DEPRIVED,Population-Weighted
963,RC_EW_463,The Broad Centre Retail Park; Ashfield (East Midlands; England),Small Retail Park,7,East Midlands,England,31.554,20.36042069,11.19357931,MORE DEPRIVED,21.66939261,9.884607386,MORE DEPRIVED,Population-Weighted
964,RC_EW_4631,Ludlow; Shropshire (West Midlands; England),Market Town,194,West Midlands,England,20.9825,24.95302782,-3.970527818,LESS DEPRIVED,21.66939261,-0.686892614,LESS DEPRIVED,Population-Weighted
965,RC_EW_4634,High Street; Bridgnorth; Shropshire (West Midlands; England),District Centre,166,West Midlands,England,13.37833333,24.95302782,-11.57469448,LESS DEPRIVED,21.66939261,-8.29105928,LESS DEPRIVED,Population-Weighted
966,RC_EW_4638,Kidderminster; Wyre Forest (West Midlands; England),Town Centre,250,West Midlands,England,38.17,24.95302782,13.21697218,MORE DEPRIVED,21.66939261,16.50060739,MORE DEPRIVED,Population-Weighted
967,RC_EW_4639,Crossley Retail Park; Wyre Forest (West Midlands; England),Large Retail Park,28,West Midlands,England,36.7615,24.95302782,11.80847218,MORE DEPRIVED,21.66939261,15.09210739,MORE DEPRIVED,Geometric
968,RC_EW_464,Sutton in Ashfield; Ashfield (East Midlands; England),District Centre,218,East Midlands,England,50.99533333,20.36042069,30.63491264,MORE DEPRIVED,21.66939261,29.32594072,MORE DEPRIVED,Population-Weighted
969,RC_EW_4646,Kingsway Retail Park; Derby (East Midlands; England),Small Retail Park,17,East Midlands,England,35.1115,20.36042069,14.75107931,MORE DEPRIVED,21.66939261,13.44210739,MORE DEPRIVED,Population-Weighted
970,RC_EW_4652,Park Farm Shopping Centre; Derby (East Midlands; England),Large Retail Park,39,East Midlands,England,4.64025,20.36042069,-15.72017069,LESS DEPRIVED,21.66939261,-17.02914261,LESS DEPRIVED,Population-Weighted
971,RC_EW_4653,Derby; Derby (East Midlands; England),Major Town Centre,827,East Midlands,England,42.29233333,20.36042069,21.93191264,MORE DEPRIVED,21.66939261,20.62294072,MORE DEPRIVED,Population-Weighted
972,RC_EW_4656,Normanton Road; Rose Hill; Derby (East Midlands; England),District Centre,220,East Midlands,England,51.5475,20.36042069,31.18707931,MORE DEPRIVED,21.66939261,29.87810739,MORE DEPRIVED,Population-Weighted
973,RC_EW_466,Station Street; Kirkby-in-Ashfield; Ashfield (East Midlands; England),Local Centre,136,East Midlands,England,29.9535,20.36042069,9.593079308,MORE DEPRIVED,21.66939261,8.284107386,MORE DEPRIVED,Population-Weighted
974,RC_EW_4661,High Street; Swadlincote; South Derbyshire (East Midlands; England),Local Centre,114,East Midlands,England,24.97266667,20.36042069,4.612245975,MORE DEPRIVED,21.66939261,3.303274053,MORE DEPRIVED,Population-Weighted
975,RC_EW_4664,Foresters Leisure Park; Derby (East Midlands; England),Small Retail Park,7,East Midlands,England,47.0105,20.36042069,26.65007931,MORE DEPRIVED,21.66939261,25.34110739,MORE DEPRIVED,Population-Weighted
976,RC_EW_4667,Dovefields Retail Park; East Staffordshire (West Midlands; England),Small Retail Park,13,West Midlands,England,10.507,24.95302782,-14.44602782,LESS DEPRIVED,21.66939261,-11.16239261,LESS DEPRIVED,Population-Weighted
977,RC_EW_4668,High Street; Uttoxeter; East Staffordshire (West Midlands; England),Market Town,162,West Midlands,England,15.94,24.95302782,-9.013027818,LESS DEPRIVED,21.66939261,-5.729392614,LESS DEPRIVED,Population-Weighted
978,RC_EW_4673,Bond End; East Staffordshire (West Midlands; England),Town Centre,421,West Midlands,England,35.058,24.95302782,10.10497218,MORE DEPRIVED,21.66939261,13.38860739,MORE DEPRIVED,Population-Weighted
979,RC_EW_4681,King Street; Belper; Amber Valley (East Midlands; England),Market Town,186,East Midlands,England,15.3715,20.36042069,-4.988920692,LESS DEPRIVED,21.66939261,-6.297892614,LESS DEPRIVED,Population-Weighted
980,RC_EW_4684,Ripley; Amber Valley (East Midlands; England),Town Centre,200,East Midlands,England,21.25211111,20.36042069,0.891690419,MORE DEPRIVED,21.66939261,-0.417281502,LESS DEPRIVED,Population-Weighted
981,RC_EW_4690,Dale Road; Matlock; Derbyshire Dales (East Midlands; England),Local Centre,144,East Midlands,England,13.094,20.36042069,-7.266420692,LESS DEPRIVED,21.66939261,-8.575392614,LESS DEPRIVED,Population-Weighted
982,RC_EW_4696,Meteor Centre Retail Park; Derby (East Midlands; England),Small Retail Park,0,East Midlands,England,20.941,20.36042069,0.580579308,MORE DEPRIVED,21.66939261,-0.728392614,LESS DEPRIVED,Geometric
983,RC_EW_47,Bideford; Torridge (South West; England),Town Centre,241,South West,England,27.47385714,18.2526559,9.221201245,MORE DEPRIVED,21.66939261,5.804464529,MORE DEPRIVED,Population-Weighted
984,RC_EW_4700,Wyvern Retail Park; Derby (East Midlands; England),Small Retail Park,0,East Midlands,England,33.323,20.36042069,12.96257931,MORE DEPRIVED,21.66939261,11.65360739,MORE DEPRIVED,Population-Weighted
985,RC_EW_471,Hucknall; Ashfield (East Midlands; England),Town Centre,172,East Midlands,England,22.78466667,20.36042069,2.424245975,MORE DEPRIVED,21.66939261,1.115274053,MORE DEPRIVED,Population-Weighted
986,RC_EW_4710,Ilkeston; Erewash (East Midlands; England),Town Centre,285,East Midlands,England,24.61,20.36042069,4.249579308,MORE DEPRIVED,21.66939261,2.940607386,MORE DEPRIVED,Population-Weighted
987,RC_EW_4712,Waterside Retail Park; Erewash (East Midlands; England),Small Retail Park,11,East Midlands,England,38.0585,20.36042069,17.69807931,MORE DEPRIVED,21.66939261,16.38910739,MORE DEPRIVED,Population-Weighted
988,RC_EW_4717,Ashbourne; Derbyshire Dales (East Midlands; England),Town Centre,162,East Midlands,England,12.401,20.36042069,-7.959420692,LESS DEPRIVED,21.66939261,-9.268392614,LESS DEPRIVED,Population-Weighted
989,RC_EW_4718,Hinckley; Hinckley and Bosworth (East Midlands; England),Town Centre,336,East Midlands,England,22.02811111,20.36042069,1.667690419,MORE DEPRIVED,21.66939261,0.358718498,MORE DEPRIVED,Population-Weighted
990,RC_EW_4722,Nuneaton; Nuneaton and Bedworth (West Midlands; England),Town Centre,287,West Midlands,England,36.49666667,24.95302782,11.54363885,MORE DEPRIVED,21.66939261,14.82727405,MORE DEPRIVED,Population-Weighted
991,RC_EW_473,Worksop; Bassetlaw (East Midlands; England),Town Centre,358,East Midlands,England,33.747875,20.36042069,13.38745431,MORE DEPRIVED,21.66939261,12.07848239,MORE DEPRIVED,Population-Weighted
992,RC_EW_4730,Junction One Retail & Leisure Park; Rugby (West Midlands; England),Large Retail Park,47,West Midlands,England,26.0895,24.95302782,1.136472182,MORE DEPRIVED,21.66939261,4.420107386,MORE DEPRIVED,Geometric
993,RC_EW_4731,Rugby; Rugby (West Midlands; England),Town Centre,338,West Midlands,England,21.48888889,24.95302782,-3.464138929,LESS DEPRIVED,21.66939261,-0.180503725,LESS DEPRIVED,Population-Weighted
994,RC_EW_4733,Long Street; Atherstone; North Warwickshire (West Midlands; England),Local Centre,137,West Midlands,England,23.99825,24.95302782,-0.954777818,LESS DEPRIVED,21.66939261,2.328857386,MORE DEPRIVED,Population-Weighted
995,RC_EW_4738,Riley Square Shopping Centre; Coventry (West Midlands; England),Large Retail Park,49,West Midlands,England,42.23875,24.95302782,17.28572218,MORE DEPRIVED,21.66939261,20.56935739,MORE DEPRIVED,Population-Weighted
996,RC_EW_4739,Warwickshire Shopping Park; Coventry (West Midlands; England),Large Retail Park,26,West Midlands,England,9.257,24.95302782,-15.69602782,LESS DEPRIVED,21.66939261,-12.41239261,LESS DEPRIVED,Population-Weighted
997,RC_EW_4747,Walsgrave Road; Middle Stoke; Coventry (West Midlands; England),Local Centre,103,West Midlands,England,27.8165,24.95302782,2.863472182,MORE DEPRIVED,21.66939261,6.147107386,MORE DEPRIVED,Population-Weighted
998,RC_EW_4748,Far Gosford Street; Gosford Green; Coventry (West Midlands; England),District Centre,152,West Midlands,England,26.52325,24.95302782,1.570222182,MORE DEPRIVED,21.66939261,4.853857386,MORE DEPRIVED,Population-Weighted
999,RC_EW_4755,Airport Retail Park; Coventry (West Midlands; England),Small Retail Park,7,West Midlands,England,32.7185,24.95302782,7.765472182,MORE DEPRIVED,21.66939261,11.04910739,MORE DEPRIVED,Population-Weighted
1000,RC_EW_4758,Alvis Retail Park; Coventry (West Midlands; England),Small Retail Park,8,West Midlands,England,20.94366667,24.95302782,-4.009361151,LESS DEPRIVED,21.66939261,-0.725725947,LESS DEPRIVED,Population-Weighted
1001,RC_EW_4765,Cannon Park Centre; Coventry (West Midlands; England),Small Retail Park,20,West Midlands,England,16.18,24.95302782,-8.773027818,LESS DEPRIVED,21.66939261,-5.489392614,LESS DEPRIVED,Population-Weighted
1002,RC_EW_4767,Coventry; Coventry (West Midlands; England),Major Town Centre,590,West Midlands,England,33.3244,24.95302782,8.371372182,MORE DEPRIVED,21.66939261,11.65500739,MORE DEPRIVED,Population-Weighted
1003,RC_EW_4769,Central Six Retail Park; Coventry (West Midlands; England),Small Retail Park,2,West Midlands,England,24.469,24.95302782,-0.484027818,LESS DEPRIVED,21.66939261,2.799607386,MORE DEPRIVED,Population-Weighted
1004,RC_EW_4777,Coalville; North West Leicestershire (East Midlands; England),Town Centre,172,East Midlands,England,20.4955,20.36042069,0.135079308,MORE DEPRIVED,21.66939261,-1.173892614,LESS DEPRIVED,Population-Weighted
1005,RC_EW_4779,Leicester Road; Blaby; Blaby (East Midlands; England),Local Centre,104,East Midlands,England,16.6635,20.36042069,-3.696920692,LESS DEPRIVED,21.66939261,-5.005892614,LESS DEPRIVED,Population-Weighted
1006,RC_EW_4781,Fosse Shopping Park; Blaby (East Midlands; England),Large Retail Park,27,East Midlands,England,10.39,20.36042069,-9.970420692,LESS DEPRIVED,21.66939261,-11.27939261,LESS DEPRIVED,Geometric
1007,RC_EW_4785,The Parade; Oadby; Oadby and Wigston (East Midlands; England),Local Centre,119,East Midlands,England,14.3565,20.36042069,-6.003920692,LESS DEPRIVED,21.66939261,-7.312892614,LESS DEPRIVED,Population-Weighted
1008,RC_EW_479,Eckington Way; Drakehouse; Sheffield (Yorkshire and The Humber; England),Local Centre,143,Yorkshire and The Humber,England,32.3235,26.00160627,6.321893729,MORE DEPRIVED,21.66939261,10.65410739,MORE DEPRIVED,Geometric
1009,RC_EW_4793,Almond Road Retail Park; Leicester (East Midlands; England),Small Retail Park,5,East Midlands,England,18.493,20.36042069,-1.867420692,LESS DEPRIVED,21.66939261,-3.176392614,LESS DEPRIVED,Population-Weighted
1010,RC_EW_4794,Leicester Road; Wigston; Oadby and Wigston (East Midlands; England),Local Centre,122,East Midlands,England,22.123,20.36042069,1.762579308,MORE DEPRIVED,21.66939261,0.453607386,MORE DEPRIVED,Population-Weighted
1011,RC_EW_4797,Evington Road; Highfields; Leicester (East Midlands; England),Local Centre,141,East Midlands,England,29.32733333,20.36042069,8.966912641,MORE DEPRIVED,21.66939261,7.65794072,MORE DEPRIVED,Population-Weighted
1012,RC_EW_4803,St. Georges Retail Park; Leicester (East Midlands; England),Small Retail Park,3,East Midlands,England,34.8285,20.36042069,14.46807931,MORE DEPRIVED,21.66939261,13.15910739,MORE DEPRIVED,Population-Weighted
1013,RC_EW_4807,Meridian Leisure Park; Blaby (East Midlands; England),Small Retail Park,0,East Midlands,England,7.44,20.36042069,-12.92042069,LESS DEPRIVED,21.66939261,-14.22939261,LESS DEPRIVED,Population-Weighted
1014,RC_EW_4808,Narborough Road; Westcotes; Leicester (East Midlands; England),District Centre,290,East Midlands,England,28.1726,20.36042069,7.812179308,MORE DEPRIVED,21.66939261,6.503207386,MORE DEPRIVED,Population-Weighted
1015,RC_EW_4814,Market Street; Ashby-de-la-Zouch; North West Leicestershire (East Midlands; England),Market Town,217,East Midlands,England,12.28,20.36042069,-8.080420692,LESS DEPRIVED,21.66939261,-9.389392614,LESS DEPRIVED,Population-Weighted
1016,RC_EW_4820,Newcastle-under-Lyme; Newcastle-under-Lyme (West Midlands; England),Town Centre,310,West Midlands,England,22.65,24.95302782,-2.303027818,LESS DEPRIVED,21.66939261,0.980607386,MORE DEPRIVED,Population-Weighted
1017,RC_EW_4823,High Street; Tunstall; Stoke-on-Trent (West Midlands; England),District Centre,179,West Midlands,England,41.74133333,24.95302782,16.78830552,MORE DEPRIVED,21.66939261,20.07194072,MORE DEPRIVED,Population-Weighted
1018,RC_EW_4825,Stoke; Stoke-on-Trent (West Midlands; England),Major Town Centre,464,West Midlands,England,47.96066667,24.95302782,23.00763885,MORE DEPRIVED,21.66939261,26.29127405,MORE DEPRIVED,Population-Weighted
1019,RC_EW_4826,Waterloo Road; Burslem; Stoke-on-Trent (West Midlands; England),District Centre,160,West Midlands,England,51.2635,24.95302782,26.31047218,MORE DEPRIVED,21.66939261,29.59410739,MORE DEPRIVED,Population-Weighted
1020,RC_EW_4829,Trentham Shopping Village; Stafford (West Midlands; England),Large Retail Park,54,West Midlands,England,7.533,24.95302782,-17.42002782,LESS DEPRIVED,21.66939261,-14.13639261,LESS DEPRIVED,Population-Weighted
1021,RC_EW_4830,Stoke-upon-Trent; Stoke-on-Trent (West Midlands; England),District Centre,187,West Midlands,England,38.83725,24.95302782,13.88422218,MORE DEPRIVED,21.66939261,17.16785739,MORE DEPRIVED,Population-Weighted
1022,RC_EW_4832,Springfields Retail Park; Newcastle-under-Lyme (West Midlands; England),Small Retail Park,4,West Midlands,England,35.744,24.95302782,10.79097218,MORE DEPRIVED,21.66939261,14.07460739,MORE DEPRIVED,Population-Weighted
1023,RC_EW_4840,Ravenside Retail Park; Stoke-on-Trent (West Midlands; England),Small Retail Park,5,NA,NA,NA,NA,NA,NA,NA,NA,NA,NA
1024,RC_EW_4843,The Strand; Longton; Stoke-on-Trent (West Midlands; England),Local Centre,144,West Midlands,England,46.13,24.95302782,21.17697218,MORE DEPRIVED,21.66939261,24.46060739,MORE DEPRIVED,Population-Weighted
1025,RC_EW_4846,Freeport Talke Stoke-on-Trent; Newcastle-under-Lyme (West Midlands; England),Small Shopping Centre,41,West Midlands,England,31.248,24.95302782,6.294972182,MORE DEPRIVED,21.66939261,9.578607386,MORE DEPRIVED,Population-Weighted
1026,RC_EW_4850,High Street; Stone; Stafford (West Midlands; England),Local Centre,138,West Midlands,England,14.0265,24.95302782,-10.92652782,LESS DEPRIVED,21.66939261,-7.642892614,LESS DEPRIVED,Population-Weighted
1027,RC_EW_4854,Longton Exchange; Stoke-on-Trent (West Midlands; England),Large Retail Park,49,West Midlands,England,36.30233333,24.95302782,11.34930552,MORE DEPRIVED,21.66939261,14.63294072,MORE DEPRIVED,Population-Weighted
1028,RC_EW_4857,Nantwich Road; Crewe; Cheshire East (North West; England),District Centre,155,North West,England,27.4892,27.90890505,-0.419705048,LESS DEPRIVED,21.66939261,5.819807386,MORE DEPRIVED,Population-Weighted
1029,RC_EW_4858,Nantwich; Cheshire East (North West; England),Market Town,284,North West,England,19.89566667,27.90890505,-8.013238381,LESS DEPRIVED,21.66939261,-1.773725947,LESS DEPRIVED,Population-Weighted
1030,RC_EW_4862,Congleton Retail Park; Cheshire East (North West; England),Small Retail Park,4,North West,England,27.203,27.90890505,-0.705905048,LESS DEPRIVED,21.66939261,5.533607386,MORE DEPRIVED,Population-Weighted
1031,RC_EW_4863,Congleton; Cheshire East (North West; England),Market Town,240,North West,England,24.18833333,27.90890505,-3.720571714,LESS DEPRIVED,21.66939261,2.51894072,MORE DEPRIVED,Population-Weighted
1032,RC_EW_4866,High Street; Cheadle; Staffordshire Moorlands (West Midlands; England),Local Centre,127,West Midlands,England,22.922,24.95302782,-2.031027818,LESS DEPRIVED,21.66939261,1.252607386,MORE DEPRIVED,Population-Weighted
1033,RC_EW_4868,Leek; Staffordshire Moorlands (West Midlands; England),Town Centre,284,West Midlands,England,20.718125,24.95302782,-4.234902818,LESS DEPRIVED,21.66939261,-0.951267614,LESS DEPRIVED,Population-Weighted
1034,RC_EW_4869,Sandbach; Cheshire East (North West; England),Local Centre,133,North West,England,20.41333333,27.90890505,-7.495571714,LESS DEPRIVED,21.66939261,-1.25605928,LESS DEPRIVED,Population-Weighted
1035,RC_EW_487,Archer Road Retail Park; Sheffield (Yorkshire and The Humber; England),Small Retail Park,19,Yorkshire and The Humber,England,16.92866667,26.00160627,-9.072939604,LESS DEPRIVED,21.66939261,-4.740725947,LESS DEPRIVED,Population-Weighted
1036,RC_EW_4871,Grand Junction Retail Park; Cheshire East (North West; England),Large Retail Park,37,North West,England,24.558,27.90890505,-3.350905048,LESS DEPRIVED,21.66939261,2.888607386,MORE DEPRIVED,Population-Weighted
1037,RC_EW_4872,Market Street; Crewe; Cheshire East (North West; England),Market Town,213,North West,England,36.619,27.90890505,8.710094952,MORE DEPRIVED,21.66939261,14.94960739,MORE DEPRIVED,Population-Weighted
1038,RC_EW_4876,High Street; Thame; South Oxfordshire (South East; England),Local Centre,128,South East,England,7.326,15.47743181,-8.15143181,LESS DEPRIVED,21.66939261,-14.34339261,LESS DEPRIVED,Population-Weighted
1039,RC_EW_4877,High Wycombe; Buckinghamshire (South East; England),Town Centre,536,South East,England,19.39433333,15.47743181,3.916901524,MORE DEPRIVED,21.66939261,-2.27505928,LESS DEPRIVED,Population-Weighted
1040,RC_EW_4880,High Wycombe Retail Park; Buckinghamshire (South East; England),Small Retail Park,9,South East,England,19.265,15.47743181,3.78756819,MORE DEPRIVED,21.66939261,-2.404392614,LESS DEPRIVED,Population-Weighted
1041,RC_EW_489,Chesterfield Road; Norton Woodseats; Sheffield (Yorkshire and The Humber; England),Local Centre,128,Yorkshire and The Humber,England,13.8968,26.00160627,-12.10480627,LESS DEPRIVED,21.66939261,-7.772592614,LESS DEPRIVED,Population-Weighted
1042,RC_EW_4890,The Kidlington Centre; Cherwell (South East; England),Large Retail Park,70,South East,England,7.5746,15.47743181,-7.90283181,LESS DEPRIVED,21.66939261,-14.09479261,LESS DEPRIVED,Population-Weighted
1043,RC_EW_4892,Cowley Road; Headington Hill; Oxford (South East; England) - 1,District Centre,179,South East,England,18.3825,15.47743181,2.90506819,MORE DEPRIVED,21.66939261,-3.286892614,LESS DEPRIVED,Population-Weighted
1044,RC_EW_4894,London Road; Headington; Oxford (South East; England),Local Centre,116,South East,England,5.9228,15.47743181,-9.55463181,LESS DEPRIVED,21.66939261,-15.74659261,LESS DEPRIVED,Population-Weighted
1045,RC_EW_4897,Templars Square Shopping Centre; Oxford (South East; England),Large Retail Park,69,South East,England,16.29933333,15.47743181,0.821901524,MORE DEPRIVED,21.66939261,-5.37005928,LESS DEPRIVED,Population-Weighted
1046,RC_EW_4898,Oxford; Oxford (South East; England),Major Town Centre,472,South East,England,17.84,15.47743181,2.36256819,MORE DEPRIVED,21.66939261,-3.829392614,LESS DEPRIVED,Population-Weighted
1047,RC_EW_4909,Westcroft District Centre; Milton Keynes (South East; England),Small Retail Park,24,South East,England,11.9355,15.47743181,-3.54193181,LESS DEPRIVED,21.66939261,-9.733892614,LESS DEPRIVED,Population-Weighted
1048,RC_EW_4910,Aylesbury; Buckinghamshire (South East; England),Town Centre,350,South East,England,21.0422,15.47743181,5.56476819,MORE DEPRIVED,21.66939261,-0.627192614,LESS DEPRIVED,Population-Weighted
1049,RC_EW_4913,Broadfields Retail Park; Buckinghamshire (South East; England),Small Retail Park,16,South East,England,25.01,15.47743181,9.53256819,MORE DEPRIVED,21.66939261,3.340607386,MORE DEPRIVED,Population-Weighted
1050,RC_EW_4918,Bicester Outlet Village; Cherwell (South East; England),Large Shopping Centre,170,South East,England,20.411,15.47743181,4.93356819,MORE DEPRIVED,21.66939261,-1.258392614,LESS DEPRIVED,Geometric
1051,RC_EW_4920,Sheep Street; Bicester; Cherwell (South East; England),Market Town,233,South East,England,15.628,15.47743181,0.15056819,MORE DEPRIVED,21.66939261,-6.041392614,LESS DEPRIVED,Population-Weighted
1052,RC_EW_4921,The Peel Centre; Bracknell Forest (South East; England),Small Retail Park,15,South East,England,23.453,15.47743181,7.97556819,MORE DEPRIVED,21.66939261,1.783607386,MORE DEPRIVED,Geometric
1053,RC_EW_4923,Bracknell; Bracknell Forest (South East; England),Town Centre,159,South East,England,17.01857143,15.47743181,1.541139619,MORE DEPRIVED,21.66939261,-4.650821185,LESS DEPRIVED,Population-Weighted
1054,RC_EW_4927,Market Place; Wokingham; Wokingham (South East; England),Local Centre,143,South East,England,7.595,15.47743181,-7.88243181,LESS DEPRIVED,21.66939261,-14.07439261,LESS DEPRIVED,Population-Weighted
1055,RC_EW_493,Abbeydale Road; Nether Edge; Sheffield (Yorkshire and The Humber; England),District Centre,162,Yorkshire and The Humber,England,20.307,26.00160627,-5.694606271,LESS DEPRIVED,21.66939261,-1.362392614,LESS DEPRIVED,Population-Weighted
1056,RC_EW_4935,Woking; Woking (South East; England),Town Centre,286,South East,England,12.47633333,15.47743181,-3.001098476,LESS DEPRIVED,21.66939261,-9.19305928,LESS DEPRIVED,Population-Weighted
1057,RC_EW_4941,Ladymead Retail Park; Guildford (South East; England),Large Retail Park,25,South East,England,7.919,15.47743181,-7.55843181,LESS DEPRIVED,21.66939261,-13.75039261,LESS DEPRIVED,Population-Weighted
1058,RC_EW_4943,Guildford; Guildford (South East; England),Major Town Centre,520,South East,England,9.668555556,15.47743181,-5.808876254,LESS DEPRIVED,21.66939261,-12.00083706,LESS DEPRIVED,Population-Weighted
1059,RC_EW_4958,Brunel Retail Park; Reading (South East; England),Large Retail Park,29,South East,England,26.9905,15.47743181,11.51306819,MORE DEPRIVED,21.66939261,5.321107386,MORE DEPRIVED,Population-Weighted
1060,RC_EW_4959,Reading Gate Retail Park; Reading (South East; England),Small Retail Park,0,South East,England,27.388,15.47743181,11.91056819,MORE DEPRIVED,21.66939261,5.718607386,MORE DEPRIVED,Geometric
1061,RC_EW_4963,Pincents Lane Retail Park; West Berkshire (South East; England),Small Retail Park,0,South East,England,6.649,15.47743181,-8.82843181,LESS DEPRIVED,21.66939261,-15.02039261,LESS DEPRIVED,Population-Weighted
1062,RC_EW_4970,Reading; Reading (South East; England),Major Town Centre,728,South East,England,22.77492308,15.47743181,7.297491267,MORE DEPRIVED,21.66939261,1.105530463,MORE DEPRIVED,Population-Weighted
1063,RC_EW_4971,Vastern Court Retail Park; Reading (South East; England),Large Retail Park,34,South East,England,18.854,15.47743181,3.37656819,MORE DEPRIVED,21.66939261,-2.815392614,LESS DEPRIVED,Population-Weighted
1064,RC_EW_4975,Forbury Retail Park; Reading (South East; England),Small Retail Park,8,South East,England,21.05033333,15.47743181,5.572901524,MORE DEPRIVED,21.66939261,-0.61905928,LESS DEPRIVED,Population-Weighted
1065,RC_EW_4977,Reading Retail Park; Reading (South East; England),Large Retail Park,29,South East,England,30.2105,15.47743181,14.73306819,MORE DEPRIVED,21.66939261,8.541107386,MORE DEPRIVED,Population-Weighted
1066,RC_EW_4979,Oxford Road; Coley; Reading (South East; England),Local Centre,149,South East,England,22.51825,15.47743181,7.04081819,MORE DEPRIVED,21.66939261,0.848857386,MORE DEPRIVED,Population-Weighted
1067,RC_EW_4983,Fleet; Hart (South East; England),Town Centre,222,South East,England,5.449142857,15.47743181,-10.02828895,LESS DEPRIVED,21.66939261,-16.22024976,LESS DEPRIVED,Population-Weighted
1068,RC_EW_4985,Farnborough; Rushmoor (South East; England),District Centre,169,South East,England,16.6015,15.47743181,1.12406819,MORE DEPRIVED,21.66939261,-5.067892614,LESS DEPRIVED,Population-Weighted
1069,RC_EW_4986,Aldershot; Rushmoor (South East; England),Town Centre,314,South East,England,20.255,15.47743181,4.77756819,MORE DEPRIVED,21.66939261,-1.414392614,LESS DEPRIVED,Population-Weighted
1070,RC_EW_499,Queens Road Retail Park; Sheffield (Yorkshire and The Humber; England),Small Retail Park,11,Yorkshire and The Humber,England,22.2985,26.00160627,-3.703106271,LESS DEPRIVED,21.66939261,0.629107386,MORE DEPRIVED,Population-Weighted
1071,RC_EW_4991,Camberley; Surrey Heath (South East; England),Town Centre,256,South East,England,9.7166,15.47743181,-5.76083181,LESS DEPRIVED,21.66939261,-11.95279261,LESS DEPRIVED,Population-Weighted
1072,RC_EW_4996,Blackwater Valley Shopping Park; Rushmoor (South East; England),Small Retail Park,10,South East,England,18.908,15.47743181,3.43056819,MORE DEPRIVED,21.66939261,-2.761392614,LESS DEPRIVED,Population-Weighted
1073,RC_EW_4999,Camp Road; North Camp; Rushmoor (South East; England),Local Centre,131,South East,England,13.69025,15.47743181,-1.78718181,LESS DEPRIVED,21.66939261,-7.979142614,LESS DEPRIVED,Population-Weighted
1074,RC_EW_5,Trelowarren Street; Camborne; Cornwall (South West; England),Market Town,192,South West,England,44.48,18.2526559,26.2273441,MORE DEPRIVED,21.66939261,22.81060739,MORE DEPRIVED,Population-Weighted
1075,RC_EW_50,Tavistock; West Devon (South West; England),Town Centre,204,South West,England,17.1424,18.2526559,-1.110255898,LESS DEPRIVED,21.66939261,-4.526992614,LESS DEPRIVED,Population-Weighted
1076,RC_EW_5014,Windsor; Windsor and Maidenhead (South East; England),Town Centre,398,South East,England,7.04,15.47743181,-8.43743181,LESS DEPRIVED,21.66939261,-14.62939261,LESS DEPRIVED,Population-Weighted
1077,RC_EW_5016,Farnham Road; Farnham Royal; Slough (South East; England),Local Centre,111,South East,England,24.10828571,15.47743181,8.630853905,MORE DEPRIVED,21.66939261,2.438893101,MORE DEPRIVED,Population-Weighted
1078,RC_EW_5017,Slough; Slough (South East; England),Town Centre,407,South East,England,27.97642857,15.47743181,12.49899676,MORE DEPRIVED,21.66939261,6.307035958,MORE DEPRIVED,Population-Weighted
1079,RC_EW_5019,Bath Road Retail Park; Slough (South East; England),Large Retail Park,34,South East,England,16.1946,15.47743181,0.71716819,MORE DEPRIVED,21.66939261,-5.474792614,LESS DEPRIVED,Population-Weighted
1080,RC_EW_502,London Road; Little Sheffield; Sheffield (Yorkshire and The Humber; England),District Centre,159,Yorkshire and The Humber,England,32.153,26.00160627,6.151393729,MORE DEPRIVED,21.66939261,10.48360739,MORE DEPRIVED,Population-Weighted
