,RC_ID,RC_Name,Classification,tr_retailN,Region,Country,AverageIMD,IMDRegional,diff_IMDRegional,r_IMDRegional,IMDNational,diff_IMDNational,r_IMDNational,whichCentroid
723,RC_EW_3770,Hereford; County of Herefordshire (West Midlands; England),Major Town Centre,505,West Midlands,England,22.1045,24.95302782,-2.848527818,LESS DEPRIVED,21.66939261,0.435107386,MORE DEPRIVED,Population-Weighted
724,RC_EW_3773,Ross-on-Wye; County of Herefordshire (West Midlands; England),Market Town,206,West Midlands,England,24.32766667,24.95302782,-0.625361151,LESS DEPRIVED,21.66939261,2.658274053,MORE DEPRIVED,Population-Weighted
725,RC_EW_3775,Leominster; County of Herefordshire (West Midlands; England),Market Town,200,West Midlands,England,35.0655,24.95302782,10.11247218,MORE DEPRIVED,21.66939261,13.39610739,MORE DEPRIVED,Population-Weighted
726,RC_EW_3781,Shirley High Street; Shirley; Southampton (South East; England),District Centre,227,South East,England,28.496,15.47743181,13.01856819,MORE DEPRIVED,21.66939261,6.826607386,MORE DEPRIVED,Population-Weighted
727,RC_EW_3785,Southampton; Southampton (South East; England),Major Town Centre,487,South East,England,30.05733333,15.47743181,14.57990152,MORE DEPRIVED,21.66939261,8.38794072,MORE DEPRIVED,Population-Weighted
728,RC_EW_379,Doncaster; Doncaster (Yorkshire and The Humber; England),Major Town Centre,662,Yorkshire and The Humber,England,46.91928571,26.00160627,20.91767944,MORE DEPRIVED,21.66939261,25.2498931,MORE DEPRIVED,Population-Weighted
729,RC_EW_3797,Commercial Road; Totton; New Forest (South East; England),Market Town,166,South East,England,16.166,15.47743181,0.68856819,MORE DEPRIVED,21.66939261,-5.503392614,LESS DEPRIVED,Population-Weighted
730,RC_EW_3798,Newport; Isle of Wight (South East; England),Town Centre,381,South East,England,31.5146,15.47743181,16.03716819,MORE DEPRIVED,21.66939261,9.845207386,MORE DEPRIVED,Population-Weighted
731,RC_EW_380,Copley Road; Doncaster; Doncaster (Yorkshire and The Humber; England),Local Centre,120,Yorkshire and The Humber,England,43.51966667,26.00160627,17.5180604,MORE DEPRIVED,21.66939261,21.85027405,MORE DEPRIVED,Population-Weighted
732,RC_EW_3800,High Street; Cowes; Isle of Wight (South East; England),Market Town,176,South East,England,18.178,15.47743181,2.70056819,MORE DEPRIVED,21.66939261,-3.491392614,LESS DEPRIVED,Population-Weighted
733,RC_EW_3806,Ringwood; New Forest (South East; England),Market Town,213,South East,England,17.232,15.47743181,1.75456819,MORE DEPRIVED,21.66939261,-4.437392614,LESS DEPRIVED,Population-Weighted
734,RC_EW_3813,"Lymington Road; Walkford; Bournemouth, Christchurch and Poole (South West; England)",Local Centre,118,South West,England,8.553,18.2526559,-9.699655898,LESS DEPRIVED,21.66939261,-13.11639261,LESS DEPRIVED,Population-Weighted
735,RC_EW_3814,Station Road; New Milton; New Forest (South East; England),District Centre,167,South East,England,17.834,15.47743181,2.35656819,MORE DEPRIVED,21.66939261,-3.835392614,LESS DEPRIVED,Population-Weighted
736,RC_EW_3816,Lymington; New Forest (South East; England),Town Centre,241,South East,England,10.91328571,15.47743181,-4.564146095,LESS DEPRIVED,21.66939261,-10.7561069,LESS DEPRIVED,Population-Weighted
737,RC_EW_3830,Portswood Road; Portswood; Southampton (South East; England),Local Centre,100,South East,England,19.824875,15.47743181,4.34744319,MORE DEPRIVED,21.66939261,-1.844517614,LESS DEPRIVED,Population-Weighted
738,RC_EW_3831,Bedford Place; Bedford Place; Southampton (South East; England),Local Centre,101,South East,England,21.77571429,15.47743181,6.298282476,MORE DEPRIVED,21.66939261,0.106321672,MORE DEPRIVED,Population-Weighted
739,RC_EW_3832,The Hundred; Romsey; Test Valley (South East; England),Market Town,162,South East,England,13.056,15.47743181,-2.42143181,LESS DEPRIVED,21.66939261,-8.613392614,LESS DEPRIVED,Population-Weighted
740,RC_EW_3834,Eastleigh; Eastleigh (South East; England),Town Centre,216,South East,England,16.40442857,15.47743181,0.926996762,MORE DEPRIVED,21.66939261,-5.264964042,LESS DEPRIVED,Population-Weighted
741,RC_EW_3837,Locks Heath Shopping Village (Locks Heath Shopping Centre); Fareham (South East; England),Large Retail Park,34,South East,England,4.976333333,15.47743181,-10.50109848,LESS DEPRIVED,21.66939261,-16.69305928,LESS DEPRIVED,Population-Weighted
742,RC_EW_3838,Southampton Road Retail Park; Fareham (South East; England),Small Retail Park,7,South East,England,7.605,15.47743181,-7.87243181,LESS DEPRIVED,21.66939261,-14.06439261,LESS DEPRIVED,Population-Weighted
743,RC_EW_3841,Whiteley Shopping Centre; Winchester (South East; England),Large Retail Park,66,South East,England,7.27,15.47743181,-8.20743181,LESS DEPRIVED,21.66939261,-14.39939261,LESS DEPRIVED,Population-Weighted
744,RC_EW_3851,Fareham; Fareham (South East; England),Town Centre,289,South East,England,13.1072,15.47743181,-2.37023181,LESS DEPRIVED,21.66939261,-8.562192614,LESS DEPRIVED,Population-Weighted
745,RC_EW_3853,Speedfields Retail Park; Fareham (South East; England),Small Retail Park,9,South East,England,29.968,15.47743181,14.49056819,MORE DEPRIVED,21.66939261,8.298607386,MORE DEPRIVED,Geometric
746,RC_EW_3854,Centre 27 Retail Park; Eastleigh (South East; England),Large Retail Park,26,South East,England,16.089,15.47743181,0.61156819,MORE DEPRIVED,21.66939261,-5.580392614,LESS DEPRIVED,Population-Weighted
747,RC_EW_3855,Hedge End Retail Park; Eastleigh (South East; England),Small Retail Park,0,South East,England,13.18,15.47743181,-2.29743181,LESS DEPRIVED,21.66939261,-8.489392614,LESS DEPRIVED,Population-Weighted
748,RC_EW_3862,High Street; Shanklin; Isle of Wight (South East; England),Market Town,190,South East,England,28.46433333,15.47743181,12.98690152,MORE DEPRIVED,21.66939261,6.79494072,MORE DEPRIVED,Population-Weighted
749,RC_EW_3864,High Street; Sandown; Isle of Wight (South East; England),Local Centre,113,South East,England,28.68133333,15.47743181,13.20390152,MORE DEPRIVED,21.66939261,7.01194072,MORE DEPRIVED,Population-Weighted
750,RC_EW_3872,"Ringwood Road Retail Park; Bournemouth, Christchurch and Poole (South West; England)",Small Retail Park,15,South West,England,39.225,18.2526559,20.9723441,MORE DEPRIVED,21.66939261,17.55560739,MORE DEPRIVED,Population-Weighted
751,RC_EW_3873,Victoria Road; Ferndown; Dorset (South West; England),Local Centre,149,South West,England,8.2725,18.2526559,-9.980155898,LESS DEPRIVED,21.66939261,-13.39689261,LESS DEPRIVED,Population-Weighted
752,RC_EW_3875,Wimborne Minster; Dorset (South West; England),District Centre,200,South West,England,9.0945,18.2526559,-9.158155898,LESS DEPRIVED,21.66939261,-12.57489261,LESS DEPRIVED,Population-Weighted
753,RC_EW_3879,East Street; Blandford Forum; Dorset (South West; England),Market Town,160,South West,England,18.98266667,18.2526559,0.730010769,MORE DEPRIVED,21.66939261,-2.686725947,LESS DEPRIVED,Population-Weighted
754,RC_EW_3883,High Street; Shaftesbury; Dorset (South West; England),Local Centre,125,South West,England,13.8695,18.2526559,-4.383155898,LESS DEPRIVED,21.66939261,-7.799892614,LESS DEPRIVED,Population-Weighted
755,RC_EW_3884,High Street; Gillingham; Dorset (South West; England),Local Centre,108,South West,England,19.518,18.2526559,1.265344102,MORE DEPRIVED,21.66939261,-2.151392614,LESS DEPRIVED,Population-Weighted
756,RC_EW_3885,High Street; Swanage; Dorset (South West; England),Market Town,175,South West,England,14.1505,18.2526559,-4.102155898,LESS DEPRIVED,21.66939261,-7.518892614,LESS DEPRIVED,Population-Weighted
757,RC_EW_3887,"High Street; Christchurch; Bournemouth, Christchurch and Poole (South West; England)",District Centre,210,South West,England,11.896,18.2526559,-6.356655898,LESS DEPRIVED,21.66939261,-9.773392614,LESS DEPRIVED,Population-Weighted
758,RC_EW_3888,"Southbourne Grove; West Southbourne; Bournemouth, Christchurch and Poole (South West; England)",Local Centre,142,South West,England,21.5752,18.2526559,3.322544102,MORE DEPRIVED,21.66939261,-0.094192614,LESS DEPRIVED,Population-Weighted
759,RC_EW_3889,"Christchurch Road; Boscombe; Bournemouth, Christchurch and Poole (South West; England)",District Centre,308,South West,England,39.63785714,18.2526559,21.38520125,MORE DEPRIVED,21.66939261,17.96846453,MORE DEPRIVED,Population-Weighted
760,RC_EW_389,The Mill Outlet Batley; Kirklees (Yorkshire and The Humber; England),Large Shopping Centre,183,Yorkshire and The Humber,England,38.14972727,26.00160627,12.148121,MORE DEPRIVED,21.66939261,16.48033466,MORE DEPRIVED,Population-Weighted
761,RC_EW_3890,"Christchurch Road; Pokesdown; Bournemouth, Christchurch and Poole (South West; England)",Local Centre,118,South West,England,26.40442857,18.2526559,8.151772674,MORE DEPRIVED,21.66939261,4.735035958,MORE DEPRIVED,Population-Weighted
762,RC_EW_3892,"Bournemouth; Bournemouth, Christchurch and Poole (South West; England)",Major Town Centre,625,South West,England,24.91914286,18.2526559,6.66648696,MORE DEPRIVED,21.66939261,3.249750244,MORE DEPRIVED,Population-Weighted
763,RC_EW_3893,"Poole Road; Westbourne; Bournemouth, Christchurch and Poole (South West; England)",District Centre,228,South West,England,18.50683333,18.2526559,0.254177436,MORE DEPRIVED,21.66939261,-3.16255928,LESS DEPRIVED,Population-Weighted
764,RC_EW_3896,"Poole Commerce Centre; Bournemouth, Christchurch and Poole (South West; England)",Large Retail Park,43,South West,England,17.10575,18.2526559,-1.146905898,LESS DEPRIVED,21.66939261,-4.563642614,LESS DEPRIVED,Population-Weighted
765,RC_EW_3898,"Wimborne Road; Winton; Bournemouth, Christchurch and Poole (South West; England)",District Centre,169,South West,England,17.53966667,18.2526559,-0.712989231,LESS DEPRIVED,21.66939261,-4.129725947,LESS DEPRIVED,Population-Weighted
766,RC_EW_39,St Austell; Cornwall (South West; England),Market Town,206,South West,England,42.74925,18.2526559,24.4965941,MORE DEPRIVED,21.66939261,21.07985739,MORE DEPRIVED,Population-Weighted
767,RC_EW_3903,"Wimborne Road; Moordown; Bournemouth, Christchurch and Poole (South West; England)",District Centre,166,South West,England,13.12171429,18.2526559,-5.130941612,LESS DEPRIVED,21.66939261,-8.547678328,LESS DEPRIVED,Population-Weighted
768,RC_EW_3904,"Parkway Retail Park; Bournemouth, Christchurch and Poole (South West; England)",Small Retail Park,23,South West,England,29.196,18.2526559,10.9433441,MORE DEPRIVED,21.66939261,7.526607386,MORE DEPRIVED,Population-Weighted
769,RC_EW_391,Bank Street; Ossett; Wakefield (Yorkshire and The Humber; England),Local Centre,128,Yorkshire and The Humber,England,19.2674,26.00160627,-6.734206271,LESS DEPRIVED,21.66939261,-2.401992614,LESS DEPRIVED,Population-Weighted
770,RC_EW_3911,"Castlepoint Shopping Park; Bournemouth, Christchurch and Poole (South West; England)",Large Retail Park,33,South West,England,16.40233333,18.2526559,-1.850322564,LESS DEPRIVED,21.66939261,-5.26705928,LESS DEPRIVED,Population-Weighted
771,RC_EW_3914,"Wessex Gate Retail Park; Bournemouth, Christchurch and Poole (South West; England)",Small Retail Park,12,South West,England,11.453,18.2526559,-6.799655898,LESS DEPRIVED,21.66939261,-10.21639261,LESS DEPRIVED,Population-Weighted
772,RC_EW_3917,"Poole; Bournemouth, Christchurch and Poole (South West; England)",Town Centre,315,South West,England,26.80325,18.2526559,8.550594102,MORE DEPRIVED,21.66939261,5.133857386,MORE DEPRIVED,Population-Weighted
773,RC_EW_3920,"Tower Park Leisure Complex; Bournemouth, Christchurch and Poole (South West; England)",Small Retail Park,17,South West,England,17.192,18.2526559,-1.060655898,LESS DEPRIVED,21.66939261,-4.477392614,LESS DEPRIVED,Population-Weighted
774,RC_EW_3921,"Ashley Road; Upper Parkstone; Bournemouth, Christchurch and Poole (South West; England)",District Centre,203,South West,England,16.13066667,18.2526559,-2.121989231,LESS DEPRIVED,21.66939261,-5.538725947,LESS DEPRIVED,Population-Weighted
775,RC_EW_3927,Petersfield; East Hampshire (South East; England),Town Centre,210,South East,England,9.860142857,15.47743181,-5.617288953,LESS DEPRIVED,21.66939261,-11.80924976,LESS DEPRIVED,Population-Weighted
776,RC_EW_393,Market Street; Heckmondwike; Kirklees (Yorkshire and The Humber; England),Local Centre,138,Yorkshire and The Humber,England,33.893,26.00160627,7.891393729,MORE DEPRIVED,21.66939261,12.22360739,MORE DEPRIVED,Population-Weighted
777,RC_EW_3930,Moorside Road Retail Park; Winchester (South East; England),Small Retail Park,18,South East,England,21.378,15.47743181,5.90056819,MORE DEPRIVED,21.66939261,-0.291392614,LESS DEPRIVED,Population-Weighted
778,RC_EW_3934,Winchester; Winchester (South East; England),Town Centre,322,South East,England,9.725272727,15.47743181,-5.752159082,LESS DEPRIVED,21.66939261,-11.94411989,LESS DEPRIVED,Population-Weighted
779,RC_EW_3938,Chineham Shopping Centre; Basingstoke and Deane (South East; England),Large Retail Park,31,South East,England,7.361,15.47743181,-8.11643181,LESS DEPRIVED,21.66939261,-14.30839261,LESS DEPRIVED,Geometric
780,RC_EW_3939,Basingstoke; Basingstoke and Deane (South East; England),Town Centre,368,South East,England,17.72514286,15.47743181,2.247711047,MORE DEPRIVED,21.66939261,-3.944249756,LESS DEPRIVED,Population-Weighted
781,RC_EW_394,Cleckheaton; Kirklees (Yorkshire and The Humber; England),District Centre,155,Yorkshire and The Humber,England,25.3755,26.00160627,-0.626106271,LESS DEPRIVED,21.66939261,3.706107386,MORE DEPRIVED,Population-Weighted
782,RC_EW_3941,Brighton Hill Retail Park; Basingstoke and Deane (South East; England),Small Retail Park,2,South East,England,12.3345,15.47743181,-3.14293181,LESS DEPRIVED,21.66939261,-9.334892614,LESS DEPRIVED,Population-Weighted
783,RC_EW_3945,Forest Centre; East Hampshire (South East; England),Small Retail Park,0,South East,England,16.77575,15.47743181,1.29831819,MORE DEPRIVED,21.66939261,-4.893642614,LESS DEPRIVED,Population-Weighted
784,RC_EW_3947,High Street; Alton; East Hampshire (South East; England),Market Town,180,South East,England,11.72433333,15.47743181,-3.753098476,LESS DEPRIVED,21.66939261,-9.94505928,LESS DEPRIVED,Population-Weighted
785,RC_EW_3949,Farnham; Waverley (South East; England),Town Centre,241,South East,England,8.65575,15.47743181,-6.82168181,LESS DEPRIVED,21.66939261,-13.01364261,LESS DEPRIVED,Population-Weighted
786,RC_EW_3959,High Street; Ryde; Isle of Wight (South East; England),Market Town,300,South East,England,33.4062,15.47743181,17.92876819,MORE DEPRIVED,21.66939261,11.73680739,MORE DEPRIVED,Population-Weighted
787,RC_EW_3961,Albert Road; Southsea; Portsmouth (South East; England),District Centre,257,South East,England,20.00573333,15.47743181,4.528301524,MORE DEPRIVED,21.66939261,-1.66365928,LESS DEPRIVED,Population-Weighted
788,RC_EW_3966,Fratton Road; Fratton; Portsmouth (South East; England),Local Centre,116,South East,England,42.19711111,15.47743181,26.7196793,MORE DEPRIVED,21.66939261,20.5277185,MORE DEPRIVED,Population-Weighted
789,RC_EW_3969,Palmerston Road; Southsea; Portsmouth (South East; England),District Centre,214,South East,England,23.98211111,15.47743181,8.504679301,MORE DEPRIVED,21.66939261,2.312718498,MORE DEPRIVED,Population-Weighted
790,RC_EW_3973,Portsmouth Gunwharf Quays; Portsmouth (South East; England),Large Shopping Centre,144,South East,England,26.359875,15.47743181,10.88244319,MORE DEPRIVED,21.66939261,4.690482386,MORE DEPRIVED,Population-Weighted
791,RC_EW_3977,Ocean Retail Park; Portsmouth (South East; England),Small Retail Park,2,South East,England,17.7,15.47743181,2.22256819,MORE DEPRIVED,21.66939261,-3.969392614,LESS DEPRIVED,Population-Weighted
792,RC_EW_3980,Portsmouth; Portsmouth (South East; England),Town Centre,210,South East,England,50.02717647,15.47743181,34.54974466,MORE DEPRIVED,21.66939261,28.35778386,MORE DEPRIVED,Population-Weighted
793,RC_EW_3981,London Road; North End; Portsmouth (South East; England),District Centre,281,South East,England,34.27571429,15.47743181,18.79828248,MORE DEPRIVED,21.66939261,12.60632167,MORE DEPRIVED,Population-Weighted
794,RC_EW_3984,Gosport; Gosport (South East; England),Town Centre,160,South East,England,29.76328571,15.47743181,14.2858539,MORE DEPRIVED,21.66939261,8.093893101,MORE DEPRIVED,Population-Weighted
795,RC_EW_3985,Stoke Road; Newtown; Gosport (South East; England),Local Centre,119,South East,England,25.607,15.47743181,10.12956819,MORE DEPRIVED,21.66939261,3.937607386,MORE DEPRIVED,Population-Weighted
796,RC_EW_3989,Chichester; Chichester (South East; England),Town Centre,422,South East,England,13.739625,15.47743181,-1.73780681,LESS DEPRIVED,21.66939261,-7.929767614,LESS DEPRIVED,Population-Weighted
797,RC_EW_3990,Portfield Retail Park; Chichester (South East; England),Small Retail Park,20,South East,England,29.599,15.47743181,14.12156819,MORE DEPRIVED,21.66939261,7.929607386,MORE DEPRIVED,Population-Weighted
798,RC_EW_3991,Bognor Regis; Arun (South East; England),Town Centre,288,South East,England,28.31281818,15.47743181,12.83538637,MORE DEPRIVED,21.66939261,6.643425568,MORE DEPRIVED,Population-Weighted
799,RC_EW_3993,Arun Retail Park; Arun (South East; England),Small Retail Park,11,South East,England,24.19,15.47743181,8.71256819,MORE DEPRIVED,21.66939261,2.520607386,MORE DEPRIVED,Population-Weighted
800,RC_EW_3999,London Road; Waterlooville; Havant (South East; England),District Centre,182,South East,England,21.00966667,15.47743181,5.532234857,MORE DEPRIVED,21.66939261,-0.659725947,LESS DEPRIVED,Population-Weighted
801,RC_EW_40,Pentewan Road Retail Park; Cornwall (South West; England),Small Retail Park,8,South West,England,53.104,18.2526559,34.8513441,MORE DEPRIVED,21.66939261,31.43460739,MORE DEPRIVED,Population-Weighted
802,RC_EW_400,Dewsbury; Kirklees (Yorkshire and The Humber; England),Town Centre,404,Yorkshire and The Humber,England,37.1975,26.00160627,11.19589373,MORE DEPRIVED,21.66939261,15.52810739,MORE DEPRIVED,Population-Weighted
803,RC_EW_4004,Havant; Havant (South East; England),Town Centre,217,South East,England,20.25985714,15.47743181,4.782425333,MORE DEPRIVED,21.66939261,-1.409535471,LESS DEPRIVED,Population-Weighted
804,RC_EW_4011,High Street; Cosham; Portsmouth (South East; England),Local Centre,141,South East,England,21.89171429,15.47743181,6.414282476,MORE DEPRIVED,21.66939261,0.222321672,MORE DEPRIVED,Population-Weighted
805,RC_EW_4017,Greywell Shopping Centre; Havant (South East; England),Large Retail Park,90,South East,England,45.18466667,15.47743181,29.70723486,MORE DEPRIVED,21.66939261,23.51527405,MORE DEPRIVED,Population-Weighted
806,RC_EW_4024,Salisbury; Wiltshire (South West; England),Major Town Centre,478,South West,England,16.07388889,18.2526559,-2.178767009,LESS DEPRIVED,21.66939261,-5.595503725,LESS DEPRIVED,Population-Weighted
807,RC_EW_4025,Bourne Retail Park; Wiltshire (South West; England),Large Retail Park,26,South West,England,9.215,18.2526559,-9.037655898,LESS DEPRIVED,21.66939261,-12.45439261,LESS DEPRIVED,Geometric
808,RC_EW_4027,Andover; Test Valley (South East; England),Town Centre,279,South East,England,16.5365,15.47743181,1.05906819,MORE DEPRIVED,21.66939261,-5.132892614,LESS DEPRIVED,Population-Weighted
809,RC_EW_403,White Rose Centre; Leeds (Yorkshire and The Humber; England),Large Shopping Centre,138,Yorkshire and The Humber,England,41.097,26.00160627,15.09539373,MORE DEPRIVED,21.66939261,19.42760739,MORE DEPRIVED,Population-Weighted
810,RC_EW_404,The Penny Hill Centre; Leeds (Yorkshire and The Humber; England),Small Retail Park,20,Yorkshire and The Humber,England,53.7365,26.00160627,27.73489373,MORE DEPRIVED,21.66939261,32.06710739,MORE DEPRIVED,Population-Weighted
811,RC_EW_4066,High Street; Ilfracombe; North Devon (South West; England),District Centre,159,South West,England,36.8898,18.2526559,18.6371441,MORE DEPRIVED,21.66939261,15.22040739,MORE DEPRIVED,Population-Weighted
812,RC_EW_4070,Barnstaple; North Devon (South West; England),Town Centre,411,South West,England,27.0354,18.2526559,8.782744102,MORE DEPRIVED,21.66939261,5.366007386,MORE DEPRIVED,Population-Weighted
813,RC_EW_409,Wakefield; Wakefield (Yorkshire and The Humber; England),Major Town Centre,659,Yorkshire and The Humber,England,35.04883333,26.00160627,9.047227063,MORE DEPRIVED,21.66939261,13.37944072,MORE DEPRIVED,Population-Weighted
814,RC_EW_4146,Seaton; East Devon (South West; England),Local Centre,136,South West,England,18.4175,18.2526559,0.164844102,MORE DEPRIVED,21.66939261,-3.251892614,LESS DEPRIVED,Population-Weighted
815,RC_EW_4149,High Street; Sidmouth; East Devon (South West; England),Market Town,182,South West,England,6.423,18.2526559,-11.8296559,LESS DEPRIVED,21.66939261,-15.24639261,LESS DEPRIVED,Population-Weighted
816,RC_EW_4152,Fore Street; Chard; South Somerset (South West; England),Local Centre,120,South West,England,28.56425,18.2526559,10.3115941,MORE DEPRIVED,21.66939261,6.894857386,MORE DEPRIVED,Population-Weighted
817,RC_EW_4156,South Street; Bridport; Dorset (South West; England),Market Town,171,South West,England,23.875,18.2526559,5.622344102,MORE DEPRIVED,21.66939261,2.205607386,MORE DEPRIVED,Population-Weighted
818,RC_EW_4157,High Street; Honiton; East Devon (South West; England),Market Town,192,South West,England,18.8775,18.2526559,0.624844102,MORE DEPRIVED,21.66939261,-2.791892614,LESS DEPRIVED,Population-Weighted
819,RC_EW_4158,High Street; Crediton; Mid Devon (South West; England),Local Centre,107,South West,England,17.00566667,18.2526559,-1.246989231,LESS DEPRIVED,21.66939261,-4.663725947,LESS DEPRIVED,Population-Weighted
820,RC_EW_4159,Exe Bridges Retail Park; Exeter (South West; England),Large Retail Park,94,South West,England,22.64783333,18.2526559,4.395177436,MORE DEPRIVED,21.66939261,0.97844072,MORE DEPRIVED,Population-Weighted
821,RC_EW_416,Queen Street; City; Leeds (Yorkshire and The Humber; England),District Centre,214,Yorkshire and The Humber,England,32.89125,26.00160627,6.889643729,MORE DEPRIVED,21.66939261,11.22185739,MORE DEPRIVED,Population-Weighted
822,RC_EW_4161,Exeter; Exeter (South West; England),Major Town Centre,654,South West,England,20.23509091,18.2526559,1.982435011,MORE DEPRIVED,21.66939261,-1.434301704,LESS DEPRIVED,Population-Weighted
823,RC_EW_4166,Rydon Lane Retail Park; Exeter (South West; England),Small Retail Park,12,South West,England,9.0225,18.2526559,-9.230155898,LESS DEPRIVED,21.66939261,-12.64689261,LESS DEPRIVED,Population-Weighted
824,RC_EW_4172,Tiverton; Mid Devon (South West; England),Town Centre,220,South West,England,25.7852,18.2526559,7.532544102,MORE DEPRIVED,21.66939261,4.115807386,MORE DEPRIVED,Population-Weighted
825,RC_EW_418,Centre 27 Leisure Park; Kirklees (Yorkshire and The Humber; England),Large Retail Park,29,Yorkshire and The Humber,England,11.617,26.00160627,-14.38460627,LESS DEPRIVED,21.66939261,-10.05239261,LESS DEPRIVED,Geometric
826,RC_EW_4180,Torquay; Torbay (South West; England),Town Centre,472,South West,England,47.2691,18.2526559,29.0164441,MORE DEPRIVED,21.66939261,25.59970739,MORE DEPRIVED,Population-Weighted
827,RC_EW_4181,Torquay Road; Preston; Torbay (South West; England),Local Centre,127,South West,England,23.44475,18.2526559,5.192094102,MORE DEPRIVED,21.66939261,1.775357386,MORE DEPRIVED,Population-Weighted
828,RC_EW_4182,Paignton; Torbay (South West; England),Town Centre,417,South West,England,33.46975,18.2526559,15.2170941,MORE DEPRIVED,21.66939261,11.80035739,MORE DEPRIVED,Population-Weighted
829,RC_EW_4184,Bridge Retail Park; Torbay (South West; England),Small Retail Park,7,South West,England,10.024,18.2526559,-8.228655898,LESS DEPRIVED,21.66939261,-11.64539261,LESS DEPRIVED,Population-Weighted
830,RC_EW_4189,Fore Street; Brixham; Torbay (South West; England),Market Town,228,South West,England,28.8915,18.2526559,10.6388441,MORE DEPRIVED,21.66939261,7.222107386,MORE DEPRIVED,Population-Weighted
831,RC_EW_4190,Totnes; South Hams (South West; England),Town Centre,223,South West,England,20.428,18.2526559,2.175344102,MORE DEPRIVED,21.66939261,-1.241392614,LESS DEPRIVED,Population-Weighted
832,RC_EW_4193,Dartmouth; South Hams (South West; England),Market Town,212,South West,England,10.5025,18.2526559,-7.750155898,LESS DEPRIVED,21.66939261,-11.16689261,LESS DEPRIVED,Population-Weighted
833,RC_EW_4194,Exmouth; East Devon (South West; England),Town Centre,311,South West,England,17.848,18.2526559,-0.404655898,LESS DEPRIVED,21.66939261,-3.821392614,LESS DEPRIVED,Population-Weighted
834,RC_EW_4195,Strand The; Dawlish; Teignbridge (South West; England),Local Centre,110,South West,England,20.864,18.2526559,2.611344102,MORE DEPRIVED,21.66939261,-0.805392614,LESS DEPRIVED,Population-Weighted
835,RC_EW_4198,Newton Abbot; Teignbridge (South West; England),Town Centre,287,South West,England,22.952,18.2526559,4.699344102,MORE DEPRIVED,21.66939261,1.282607386,MORE DEPRIVED,Population-Weighted
836,RC_EW_420,Shirebrook; Bolsover (East Midlands; England),Local Centre,107,East Midlands,England,34.839,20.36042069,14.47857931,MORE DEPRIVED,21.66939261,13.16960739,MORE DEPRIVED,Population-Weighted
837,RC_EW_4202,Teignmouth; Teignbridge (South West; England),Market Town,225,South West,England,32.93,18.2526559,14.6773441,MORE DEPRIVED,21.66939261,11.26060739,MORE DEPRIVED,Population-Weighted
838,RC_EW_4205,Yeovil; South Somerset (South West; England),Town Centre,335,South West,England,28.20616667,18.2526559,9.953510769,MORE DEPRIVED,21.66939261,6.536774053,MORE DEPRIVED,Population-Weighted
839,RC_EW_4206,Houndstone Retail Park; South Somerset (South West; England),Small Retail Park,3,South West,England,8.8245,18.2526559,-9.428155898,LESS DEPRIVED,21.66939261,-12.84489261,LESS DEPRIVED,Population-Weighted
840,RC_EW_4208,Cheap Street; Sherborne; Dorset (South West; England),Local Centre,110,South West,England,11.219,18.2526559,-7.033655898,LESS DEPRIVED,21.66939261,-10.45039261,LESS DEPRIVED,Population-Weighted
841,RC_EW_4212,High Street; Glastonbury; Mendip (South West; England),Market Town,171,South West,England,26.0976,18.2526559,7.844944102,MORE DEPRIVED,21.66939261,4.428207386,MORE DEPRIVED,Population-Weighted
